{
  "$schema": "http://json-schema.org/draft-07/schema#",
  "type": "object",
  "properties": {
    "personal": {
      "type": "object",
      "properties": {
        "name": {"type": "string"},
        "title": {"type": "string"},
        "email": {"type": "string"},
        "phone": {"type": "string"},
        "location": {"type": "string"},
        "website": {"type": "string"},
        "linkedin": {"type": "string"},
        "github": {"type": "string"},
        "portfolio": {"type": "string"}
      },
      "required": ["name", "email"]
    },
    "summary": {"type": "string"},
    "experience": {
      "type": "array",
      "items": {
        "type": "object",
        "properties": {
          "company": {"type": "string"},
          "position": {"type": "string"},
          "location": {"type": "string"},
          "startDate": {"type": "string"},
          "endDate": {"type": "string"},
          "current": {"type": "boolean"},
          "description": {"type": "string"},
          "achievements": {
            "type": "array",
            "items": {"type": "string"}
          }
        },
        "required": ["company", "position", "startDate"]
      }
    },
    "education": {
      "type": "array",
      "items": {
        "type": "object",
        "properties": {
          "institution": {"type": "string"},
          "degree": {"type": "string"},
          "field": {"type": "string"},
          "location": {"type": "string"},
          "startDate": {"type": "string"},
          "endDate": {"type": "string"},
          "gpa": {"type": "string"},
          "honors": {"type": "string"}
        },
        "required": ["institution", "degree"]
      }
    },
    "skills": {
      "type": "array",
      "items": {
        "type": "object",
        "properties": {
          "category": {"type": "string"},
          "items": {
            "type": "array",
            "items": {"type": "string"}
          },
          "level": {"type": "string"}
        }
      }
    },
    "projects": {
      "type": "array",
      "items": {
        "type": "object",
        "properties": {
          "name": {"type": "string"},
          "description": {"type": "string"},
          "url": {"type": "string"},
          "technologies": {
            "type": "array",
            "items": {"type": "string"}
          },
          "date": {"type": "string"}
        }
      }
    },
    "certifications": {
      "type": "array",
      "items": {
        "type": "object",
        "properties": {
          "name": {"type": "string"},
          "issuer": {"type": "string"},
          "date": {"type": "string"},
          "url": {"type": "string"}
        }
      }
    }
  },
  "required": ["personal"]
}
